{
  "contract_version": "renewal-handoff/v1",
  "record_type": "renewal_report_nursing_to_fh",
  "renewal_id": "REN-SYN-0002",
  "line_id": "line-syn-rn-002",
  "patient_id": "patient-syn-rn-002",
  "service_id": "svc-syn-reu-01",
  "report_type": "RENOVACIÓN_COMUNICADA",
  "reported_at": "2026-10-06T10:00:00Z",
  "reported_by": "enfermeria-demo",
  "reported_by_role": "nursing",
  "comment": "Renovacion comunicada por el servicio prescriptor (sintetico). No es validacion FH.",
  "demo_flag": true
}
